link;reference;title;jobLocation;datePosted;employmentType;duration.months;workHours;baseSalary;Salaire.brut.min;Salaire.brut.max;educationRequirements;experienceRequirements
https://emploi.cnrs.fr/Offres/CDD/UMR6502-ANNHEN-006/Default.aspx;UMR6502-ANNHEN-006;Contrat post-doc H/F pour développement de méthodes de cryo-microscopie électronique et spectroscopie pour l étude des vésicules extracellulaires à l interface du tissu osseux et de son microenvironnement;NANTES;lundi 25 janvier 2021;CDD Scientifique;18;Temps complet;entre 2675 et 3977 euros bruts mensuels, selon expérience;2675;3977;Doctorat;Indifférent
https://emploi.cnrs.fr/Offres/CDD/UMR6502-PATABE-002/Default.aspx;UMR6502-PATABE-002;Contrat post-doc H/F pour développement de méthodes de cryo-microscopie électronique et spectroscopie pour l étude des vésicules extracellulaires à l interface du tissu osseux et de son microenvironnement;NANTES;mercredi 18 novembre 2020;CDD Scientifique;18;Temps complet;entre 2675 et 3977 euros bruts mensuels, selon expérience;2675;3977;Doctorat;Indifférent
https://emploi.cnrs.fr/Offres/CDD/UMR7315-ALADEN-002/Default.aspx;UMR7315-ALADEN-002;Chercheur en développement de dépôt pour application aéroaunotique (H/F);LIMOGES;jeudi 1 avril 2021;CDD Scientifique;5;Temps complet;2648 et 3968 € bruts mensuels selon expérience;2648;3968;Bac+5;5 à 10 années
https://emploi.cnrs.fr/Offres/CDD/UPR2001-SEVBON-025/Default.aspx;UPR2001-SEVBON-025;"Chercheur(se)- ""Biodiversité, Changement Climatique et Comportement humain""(H/F)";MOULIS;vendredi 12 mars 2021;CDD Scientifique;12;Temps complet;Entre 3768.24 € et 3938.59 € bruts mensuels selon expérience;3768.24;3938.59;Doctorat;5 à 10 années
https://emploi.cnrs.fr/Offres/CDD/UMR7252-BENWET-001/Default.aspx;UMR7252-BENWET-001;Chercheur Postdoctoral en Photonique (H/F);LIMOGES;jeudi 19 novembre 2020;CDD Scientifique;12;Temps complet;entre 2648.79 € et 3938.59 € bruts mensuels (selon expérience entre 0 - 10 ans);2648.79;3938.59;Doctorat;Indifférent
https://emploi.cnrs.fr/Offres/CDD/UPR8001-ALAEST-003/Default.aspx;UPR8001-ALAEST-003;Évaluation théorique de la réactivité et des propriétés catalytiques des oxydes en contact avec différents environnements (H/F);TOULOUSE;vendredi 12 mars 2021;CDD Scientifique;12;Temps complet;3768 et 3938 euros brut mensuel selon expérience;3768;3938;Doctorat;Indifférent
https://emploi.cnrs.fr/Offres/CDD/UPR8001-AURCLO-001/Default.aspx;UPR8001-AURCLO-001;Chercheuse/Chercheur CDD en Interaction Humain-Robot (projet AI4HRI) (H/F);TOULOUSE;lundi 22 février 2021;CDD Scientifique;12;Temps complet;entre 2648 et 3938€ brut mensuel selon expérience;2648;3938;Doctorat;Indifférent
https://emploi.cnrs.fr/Offres/CDD/UPR3079-ELOOEH-005/Default.aspx;UPR3079-ELOOEH-005;Chercheur CDD H/F en RMN pour le stockage de l énergie;ORLEANS;mardi 9 février 2021;CDD Scientifique;6;Temps complet;entre 2648 et 3938 € bruts mensuels selon expérience;2648;3938;Doctorat;1 à 4 années
https://emploi.cnrs.fr/Offres/CDD/UMR6174-FRACOU-004/Default.aspx;UMR6174-FRACOU-004;postdoc in Ultrafast laser micromachining (H/F);BESANCON;lundi 22 mars 2021;CDD Scientifique;14;Temps complet;entre 32000 et 47000 euros bruts annuel selon expérience;2666.66666666667;3916.66666666667;Doctorat;Indifférent
https://emploi.cnrs.fr/Offres/CDD/UMR6144-GERTHO-001/Default.aspx;UMR6144-GERTHO-001;H/F Chercheur.e post-doctoral en bioanalyse appliquée à l environnement;LA ROCHE SUR YON;jeudi 18 mars 2021;CDD Scientifique;12;Temps complet;Salaire Brut : entre 3750 et 3900  €/mois selon expérience;3750;3900;Doctorat;5 à 10 années
https://emploi.cnrs.fr/Offres/CDD/UMR8506-STEDOU-010/Default.aspx;UMR8506-STEDOU-010;Postdoc H/F - MPC (Model-Based Predictive Control) pour le traitement des congestions des réseaux énergétiques : du traitement zonal vers un prise en compte du réseau dans sa globalité;GIF SUR YVETTE;lundi 8 février 2021;CDD Scientifique;12;Temps complet;entre 2900 et 3900€ bruts selon expérience;2900;3900;Doctorat;Indifférent
https://emploi.cnrs.fr/Offres/CDD/UMR8506-STEDOU-008/Default.aspx;UMR8506-STEDOU-008;Postdoc H/F - MPC (Model-Based Predictive Control) pour le traitement des congestions des réseaux énergétiques : du traitement zonal vers un prise en compte du réseau dans sa globalité;GIF SUR YVETTE;vendredi 18 décembre 2020;CDD Scientifique;12;Temps complet;entre 2900 et 3900€ bruts selon expérience;2900;3900;Doctorat;Indifférent
https://emploi.cnrs.fr/Offres/CDD/UMR6226-KARCOS-002/Default.aspx;UMR6226-KARCOS-002;Chercheur postdoctoral en chimie computationnelle (H/F);RENNES;mercredi 6 janvier 2021;CDD Scientifique;12;Temps complet;entre 2640 et 3900 euros bruts mensuels;2640;3900;Doctorat;Indifférent
https://emploi.cnrs.fr/Offres/CDD/UMR7638-RAPGRA-004/Default.aspx;UMR7638-RAPGRA-004;Postdoc (H/F) pour étudier le jet quenching avec CMS;PALAISEAU;lundi 1 mars 2021;CDD Scientifique;36;Temps complet;Entre 2728 et 3890 € bruts, dépendant de l expérience;2728;3890;Bac+5;Indifférent
https://emploi.cnrs.fr/Offres/CDD/UMR8171-ROMTIQ-001/Default.aspx;UMR8171-ROMTIQ-001;3 postes de chercheur·e postdoctorant·e (H/F);AIX EN PROVENCE;lundi 5 avril 2021;CDD Scientifique;24;Temps complet;entre 2730 et 3885 euros bruts mensuels selon expérience;2730;3885;Doctorat;Indifférent
https://emploi.cnrs.fr/Offres/CDD/UMR5672-LUCSAV-001/Default.aspx;UMR5672-LUCSAV-001;Posdoctorat en théorie de la matière condensée (H/F);LYON 07;vendredi 12 février 2021;CDD Scientifique;24;Temps complet;entre 2 638€ et 3882€ bruts mensuels selon expérience;2638;3882;Doctorat;1 à 4 années
https://emploi.cnrs.fr/Offres/CDD/UMR7340-SOPBAU-009/Default.aspx;UMR7340-SOPBAU-009;H/F chercheur - exploitation de SOLEDGE3X-HDG dans le cadre de simulations tridimensionnelles;MARSEILLE 13;mardi 9 mars 2021;CDD Scientifique;2;Temps complet;entre 2728.26 et 3881.92 euros bruts mensuels selon expérience;2728.26;3881.92;Doctorat;Indifférent
https://emploi.cnrs.fr/Offres/CDD/UMR7340-SOPBAU-008/Default.aspx;UMR7340-SOPBAU-008;H/F chercheur en Modélisation numérique des plasmas de bord de tokamak pour la fusion par confinement magnétique;MARSEILLE 13;mardi 8 décembre 2020;CDD Scientifique;12;Temps complet;entre 2728.26 et 3881.92 euros bruts mensuels selon expérience;2728.26;3881.92;Doctorat;Indifférent
https://emploi.cnrs.fr/Offres/CDD/UMR7330-NOEGAR-016/Default.aspx;UMR7330-NOEGAR-016;H/F Chercheur(e) Bio-Chimie, spectrométrie UV-VIS;AIX EN PROVENCE;jeudi 4 mars 2021;CDD Scientifique;15;Temps complet;fourchette entre 2728,26 et 3881.29 € bruts mensuels;2728.26;3881.29;Doctorat;1 à 4 années
https://emploi.cnrs.fr/Offres/CDD/UMR7330-NOEGAR-017/Default.aspx;UMR7330-NOEGAR-017;H/F Chercheur(e) Physico-chimie des matériaux;AIX EN PROVENCE;vendredi 5 mars 2021;CDD Scientifique;12;Temps complet;fourchette entre 2728,26 et 3881.29 € bruts mensuels;2728.26;3881.29;Doctorat;1 à 4 années
https://emploi.cnrs.fr/Offres/CDD/UMR7280-HUGLEL-001/Default.aspx;UMR7280-HUGLEL-001;Chercheur(se)  H/F;MARSEILLE 09;lundi 15 février 2021;CDD Scientifique;24;Temps complet;entre 2728.26 et 3881.29 euros bruts mensuels selon expérience;2728.26;3881.29;Doctorat;Indifférent
https://emploi.cnrs.fr/Offres/CDD/UMR7289-EDUGAS-001/Default.aspx;UMR7289-EDUGAS-001;Chercheur-e en neurobiologie moleculaire (H/F);MARSEILLE 05;jeudi 10 décembre 2020;CDD Scientifique;12;Temps complet;Entre 2728,26 et 3881,29 euros bruts mensuels selon expérience;2728.26;3881.29;Doctorat;1 à 4 années
https://emploi.cnrs.fr/Offres/CDD/UMR7345-ERIROS-018/Default.aspx;UMR7345-ERIROS-018;Physicien (H/F) - spécialiste modélisation en physique atomique et moléculaire;MARSEILLE 13;jeudi 26 novembre 2020;CDD Scientifique;12;Temps complet;Entre 2728,26 € et 3881,29 €  bruts mensuel selon experience;2728.26;3881.29;Doctorat;1 à 4 années
https://emploi.cnrs.fr/Offres/CDD/UMR7031-SANGUE-019/Default.aspx;UMR7031-SANGUE-019;Chercheur H/F :  Localisation des ondes en milieu élastique fortement hétérogène;MARSEILLE 13;mardi 1 décembre 2020;CDD Scientifique;12;Temps complet;Entre 2728,26 et 3881,29 € bruts mensuels selon expérience;2728.26;3881.29;Doctorat;Indifférent
https://emploi.cnrs.fr/Offres/CDD/UMR7330-ALELIC-001/Default.aspx;UMR7330-ALELIC-001;H/F CDD Chercheur junior en géochimie isotopique et paléoclimats;AIX EN PROVENCE;vendredi 4 décembre 2020;CDD Scientifique;16;Temps complet;fourchette entre 2728,26 et 3881.29 € bruts mensuels;2728.26;3881.29;Doctorat;1 à 4 années
https://emploi.cnrs.fr/Offres/CDD/UMR7586-MATMOR-001/Default.aspx;UMR7586-MATMOR-001;Post-doc ERC H/F;PARIS 05;mercredi 20 janvier 2021;CDD Scientifique;24;Temps complet;Entre 2728€ et 3881,29€ brut mensuel selon expérience.;2728;3881.29;Doctorat;Indifférent
https://emploi.cnrs.fr/Offres/CDD/UMR7164-SANMER-010/Default.aspx;UMR7164-SANMER-010;"Chercheur ""Amélioration des algorithmes de reconstruction de traces et développements en photodetection pour la future expérience DUNE""(H/F)";PARIS 13;jeudi 25 mars 2021;CDD Scientifique;24;Temps complet;Entre 3 145.68 € et 3 881.28 € bruts mensuels;3145.68;3881.28;Doctorat;Indifférent
https://emploi.cnrs.fr/Offres/CDD/UMR7533-ZOEVAI-001/Default.aspx;UMR7533-ZOEVAI-001;Chercheur H/F CDD sur les inégalités socio-territoriales de santé et politiques locales de santé publique en Seine-Saint-Denis.;AUBERVILLIERS;vendredi 8 janvier 2021;CDD Scientifique;18;Temps complet;entre 2728.25€ et 3881.28€ bruts mensuels selon expérience;2728.25;3881.28;Doctorat;1 à 4 années
https://emploi.cnrs.fr/Offres/CDD/UMR7334-DELSTU-031/Default.aspx;UMR7334-DELSTU-031;Modélisation de la décomposition spinodale dans le système fer-carbonne H/F;MARSEILLE 13;vendredi 11 décembre 2020;CDD Scientifique;12;Temps complet;entre 2728.25 et 3881,28€ bruts mensuels selon expérience;2728.25;3881.28;Doctorat;1 à 4 années
https://emploi.cnrs.fr/Offres/CDD/UMR7334-DELSTU-020/Default.aspx;UMR7334-DELSTU-020;Conception de système mixte (mémoire RRAM et numérique/analogique) visant un accélérateur matériel de réseau neurones artificiels H/F;MARSEILLE 13;mercredi 18 novembre 2020;CDD Scientifique;17;Temps complet;entre 2728.25 et 3881.28€ brut mensuel selon expérience;2728.25;3881.28;Doctorat;1 à 4 années
https://emploi.cnrs.fr/Offres/CDD/UMR7539-YONHAR-001/Default.aspx;UMR7539-YONHAR-001;Chercheur en mathématiques (H/F);VILLETANEUSE;lundi 29 mars 2021;CDD Scientifique;12;Temps complet;Entre 3145 et 3881 euros bruts mensuels selon l expérience.;3145;3881;Doctorat;1 à 4 années
https://emploi.cnrs.fr/Offres/CDD/UMR7162-NATMER0-010/Default.aspx;UMR7162-NATMER0-010;Postdoctoral offer on Optoelectronic Metamaterials F/H (H/F);PARIS 13;mardi 2 mars 2021;CDD Scientifique;18;Temps complet;entre 3145€ et 3881€ brut mensuel selon expérience;3145;3881;Bac+5;Indifférent
https://emploi.cnrs.fr/Offres/CDD/UMR5221-ADRNOU-002/Default.aspx;UMR5221-ADRNOU-002;Postdoc - Développement de dispositifs à base d oscillateurs mécaniques à nanotube de carbone pour la nanofluidique, H/F;MONTPELLIER;mercredi 20 janvier 2021;CDD Scientifique;8;Temps complet;Entre 2914 € et 3881 € bruts mensuels, selon expérience;2914;3881;Doctorat;Indifférent
https://emploi.cnrs.fr/Offres/CDD/UMR9012-VALPIA-006/Default.aspx;UMR9012-VALPIA-006;Chercheur (H/F) en Astroparticules Nature et origine des rayons cosmiques aux plus hautes énergies.;ORSAY;lundi 22 mars 2021;CDD Scientifique;31;Temps complet;Entre 2728 à 3881 Euros brut mensuel selon expérience (sera mis à jour par le service RH si évolution);2728;3881;Doctorat;1 à 4 années
https://emploi.cnrs.fr/Offres/CDD/UMR8002-MARBAR-001/Default.aspx;UMR8002-MARBAR-001;Chercheur / chercheuse post doctorant(e) en développement sensori-moteur du nourrisson (H/F);PARIS 06;mercredi 24 mars 2021;CDD Scientifique;18;Temps incomplet;entre 2 728 et 3 881 brut mensuels selon expérience;2728;3881;Doctorat;Indifférent
https://emploi.cnrs.fr/Offres/CDD/UMR7095-FREDAI-002/Default.aspx;UMR7095-FREDAI-002;Contrat Postdoctoral en astrophysique multi-messagers (H/F);PARIS 14;lundi 8 mars 2021;CDD Scientifique;24;Temps complet;Salaire brut mensuel compris entre 2728€ et 3881€ selon expérience.;2728;3881;Doctorat;Indifférent
https://emploi.cnrs.fr/Offres/CDD/UMR7346-ANNPOR-057/Default.aspx;UMR7346-ANNPOR-057;CDD Chercheur expérience Belle II  (H/F);MARSEILLE 09;mardi 2 mars 2021;CDD Scientifique;36;Temps complet;entre 2728 € et 3881 € bruts mensuels  selon expérience;2728;3881;Bac+5;Indifférent
https://emploi.cnrs.fr/Offres/CDD/UMR8552-PIENAC-002/Default.aspx;UMR8552-PIENAC-002;Post-doctorant.e en études par RMN de diffusion gazeuse dans des matériaux nanoporeux (H/F);PARIS 05;jeudi 4 mars 2021;CDD Scientifique;18;Temps complet;entre 2728 et 3881 € bruts mensuels selon expérience;2728;3881;Doctorat;1 à 4 années
https://emploi.cnrs.fr/Offres/CDD/UMR7598-DANIVA-001/Default.aspx;UMR7598-DANIVA-001;Chercheur post-doctoral en mathématiques (H/F);PARIS 05;vendredi 19 février 2021;CDD Scientifique;12;Temps complet;Entre 2728 euros et 3881 euros bruts mensuel selon l expérience.;2728;3881;Doctorat;Indifférent
https://emploi.cnrs.fr/Offres/CDD/UMR5208-FRAFAN-001/Default.aspx;UMR5208-FRAFAN-001;Offre de post-doc en EDP (H/F);VILLEURBANNE;lundi 22 février 2021;CDD Scientifique;12;Temps complet;Entre 2728€ et 3881€ brut mensuel (selon expérience).;2728;3881;Doctorat;1 à 4 années
https://emploi.cnrs.fr/Offres/CDD/UMR7592-DELDEL-003/Default.aspx;UMR7592-DELDEL-003;Offre contrat postdoctoral sur la morphogenèse épithélaile à l IJM, Paris 13e, France (H/F);PARIS 13;jeudi 25 février 2021;CDD Scientifique;12;Temps complet;Entre 2728 et 3881 euros bruts mensuels selon expérience;2728;3881;Bac+5;Indifférent
https://emploi.cnrs.fr/Offres/CDD/UMR3685-FLOMER-001/Default.aspx;UMR3685-FLOMER-001;Etude des mécanismes de corrosion d aciers mis en corrosion sans et avec protection cathodique sur site d épaves métalliques coulées lors de la seconde guerre mondiale  (H/F);GIF SUR YVETTE;vendredi 5 février 2021;CDD Scientifique;12;Temps complet;entre 2728 et 3881 bruts mensuels selon expérience;2728;3881;Doctorat;1 à 4 années
https://emploi.cnrs.fr/Offres/CDD/UMR7212-PASLES-001/Default.aspx;UMR7212-PASLES-001;Postdoctorat sur le rôle de l ADN mobile dans la plasticité du genome H/F;PARIS 10;lundi 1 février 2021;CDD Scientifique;12;Temps complet;2728€ à 3881€ brut menseul selon expérience;2728;3881;Bac+5;1 à 4 années
https://emploi.cnrs.fr/Offres/CDD/UMR8552-PIENAC-001/Default.aspx;UMR8552-PIENAC-001;Post-doctorant.e en études par RMN de diffusion gazeuse dans des matériaux nanoporeux (H/F);PARIS 05;mardi 12 janvier 2021;CDD Scientifique;18;Temps complet;entre 2728 et 3881 € bruts mensuels selon expérience;2728;3881;Doctorat;1 à 4 années
https://emploi.cnrs.fr/Offres/CDD/UMR7590-MATROS-001/Default.aspx;UMR7590-MATROS-001;Postdoctorat (H/F) : Caractérisation minéralogique et spectroscopique des échantillons de la mission Hayabusa2;PARIS 05;mardi 19 janvier 2021;CDD Scientifique;17;Temps complet;environ 2728 et 3881€ mensuels brut selon expérience;2728;3881;Doctorat;1 à 4 années
https://emploi.cnrs.fr/Offres/CDD/UMR5208-VINCAL-005/Default.aspx;UMR5208-VINCAL-005;Post-doctorat (H/F) en mathématiques avec applications à la biologie;VILLEURBANNE;lundi 4 janvier 2021;CDD Scientifique;12;Temps complet;Entre 2728€ et 3881€ brut mensuel (selon expérience);2728;3881;Bac+5;1 à 4 années
https://emploi.cnrs.fr/Offres/CDD/UMR7074-JEAHAL0-004/Default.aspx;UMR7074-JEAHAL0-004;Post-doctorat en droit comparé, Inde, statuts personnles (H/F);NANTERRE;mercredi 23 décembre 2020;CDD Scientifique;12;Temps complet;Entre 2 728 et 3 881 € bruts mensuels selon expérience;2728;3881;Bac+5;Indifférent
https://emploi.cnrs.fr/Offres/CDD/UMR9012-DAVLUN-001/Default.aspx;UMR9012-DAVLUN-001;Chercheur postdoctoral dans le domaine de la physique du stockage des antiparticules (H/F);ORSAY;vendredi 18 décembre 2020;CDD Scientifique;12;Temps complet;Entre 2728 et 3881€ bruts mensuels selon expérience;2728;3881;Doctorat;1 à 4 années
https://emploi.cnrs.fr/Offres/CDD/UMR8249-KARBEN-001/Default.aspx;UMR8249-KARBEN-001;Post-doctorant (H/F) en Electrophysiologie;PARIS 05;vendredi 18 décembre 2020;CDD Scientifique;24;Temps complet;entre 2728€ et 3881€ brut selon experience;2728;3881;Bac+5;Indifférent
https://emploi.cnrs.fr/Offres/CDD/UMR7592-ANTJEG-001/Default.aspx;UMR7592-ANTJEG-001;Chercheur-e post-doctorant-e (H/F) en Biophysique;PARIS 13;vendredi 11 décembre 2020;CDD Scientifique;12;Temps complet;Entre 2728 et 3881 euros brut mensuels selon expérience.;2728;3881;Doctorat;1 à 4 années
https://emploi.cnrs.fr/Offres/CDD/UMR5208-VINCAL-003/Default.aspx;UMR5208-VINCAL-003;Post-doctorat (H/F) en mathématiques;VILLEURBANNE;vendredi 11 décembre 2020;CDD Scientifique;6;Temps complet;Entre 2728€ et 3881€ brut mensuel (selon expérience);2728;3881;Doctorat;1 à 4 années
https://emploi.cnrs.fr/Offres/CDD/UMR5208-VINCAL-004/Default.aspx;UMR5208-VINCAL-004;Post-doctorat (H/F) en mathématiques;VILLEURBANNE;vendredi 11 décembre 2020;CDD Scientifique;6;Temps complet;Entre 2728€ et 3881€ brut mensuel (selon expérience);2728;3881;Doctorat;1 à 4 années
https://emploi.cnrs.fr/Offres/CDD/UMR8213-DIMROD0-001/Default.aspx;UMR8213-DIMROD0-001;chercheur post-doctoral H/F;PARIS 05;mercredi 9 décembre 2020;CDD Scientifique;12;Temps complet;2728 à 3881 Euros brute;2728;3881;Doctorat;1 à 4 années
https://emploi.cnrs.fr/Offres/CDD/UMR104-HAKAMA-002/Default.aspx;UMR104-HAKAMA-002;Post-doc (H/F) : Modélisation atomistique d alliages métalliques magnétiques : du massif au nano.;CHATILLON;lundi 7 décembre 2020;CDD Scientifique;5;Temps complet;entre 2728€ et 3881€ bruts mensuels selon expérience;2728;3881;Doctorat;1 à 4 années
https://emploi.cnrs.fr/Offres/CDD/UMR8023-FRAPET-001/Default.aspx;UMR8023-FRAPET-001;Postdoctorat expérimentateur en turbulence  H/F;PARIS 05;lundi 7 décembre 2020;CDD Scientifique;12;Temps complet;entre 2728 et 3881 euros bruts mensuels;2728;3881;Bac+5;Indifférent
https://emploi.cnrs.fr/Offres/CDD/UMR7162-NATMER0-009/Default.aspx;UMR7162-NATMER0-009;Post-doctorat en Nano-Optomécanique Quantique et Fluides  (F/H) (H/F);PARIS 13;lundi 7 décembre 2020;CDD Scientifique;24;Temps complet;entre 2728 et 3881 euros brut mensuel en fonction de l expérience;2728;3881;Bac+5;Indifférent
https://emploi.cnrs.fr/Offres/CDD/UMR7592-DELDEL-002/Default.aspx;UMR7592-DELDEL-002;Offre contrat postdoctoral sur la morphogenèse épithéliale à l IJM, Paris, France (H/F);PARIS 13;vendredi 20 novembre 2020;CDD Scientifique;12;Temps complet;Entre 2728 et 3881 euros brut mensuels selon expérience.;2728;3881;Bac+5;1 à 4 années
https://emploi.cnrs.fr/Offres/CDD/UMR8134-OZAKAR-003/Default.aspx;UMR8134-OZAKAR-003;(H/F) Chercheur.e en économie politique urbaine, avec spécialisation dans l Immobilier;MARNE LA VALLEE;mardi 1 décembre 2020;CDD Scientifique;24;Temps complet;entre 2728 et 3881 €  brut mensuel selon expérience.;2728;3881;Doctorat;Indifférent
https://emploi.cnrs.fr/Offres/CDD/UMR7164-NADOKA-007/Default.aspx;UMR7164-NADOKA-007;Chercheur H/F : développements scientifiques liés à l instrument ECLAIRs à bord de la mission SVOM.;PARIS 13;mardi 1 décembre 2020;CDD Scientifique;12;Temps complet;entre 2728 et 3881 euros bruts mensuels selon l expérience;2728;3881;Doctorat;1 à 4 années
https://emploi.cnrs.fr/Offres/CDD/UMR7317-NATBES-007/Default.aspx;UMR7317-NATBES-007;Chercheur(e)/Post-Doc (H/F) en Sciences Humaines et Sociales - Programme de recherche ANR VICO;AIX EN PROVENCE;mardi 1 décembre 2020;CDD Scientifique;6;Temps complet;entre 2728 et 3881 euros bruts mensuels selon expérience;2728;3881;Doctorat;1 à 4 années
https://emploi.cnrs.fr/Offres/CDD/UMR168-CATVIL-002/Default.aspx;UMR168-CATVIL-002;Chercheur en Microfluidique  H/F;PARIS 05;mardi 1 décembre 2020;CDD Scientifique;4;Temps complet;de 2728 € à 3881 € brut selon expérience;2728;3881;Doctorat;1 à 4 années
https://emploi.cnrs.fr/Offres/CDD/UMR8180-SOLBEC-001/Default.aspx;UMR8180-SOLBEC-001;Position postdoctorale en gravure chimique et analyse de surface de super-réseaux III-V H/F;VERSAILLES;lundi 25 janvier 2021;CDD Scientifique;18;Temps complet;entre 2648 et 3881 € brut mensuels selon expérience;2648;3881;Doctorat;Indifférent
https://emploi.cnrs.fr/Offres/CDD/MOY1500-FRADJI1-052/Default.aspx;MOY1500-FRADJI1-052;Chargé(e) de communication H/F;TALENCE;mardi 1 décembre 2020;CDD Technique/Administratif;12;Temps complet;entre 2088€ et 2206€ bruts menseuls selon expérience;2088;3881;Bac+5;1 à 4 années
https://emploi.cnrs.fr/Offres/CDD/UMR7592-ISALAD-026/Default.aspx;UMR7592-ISALAD-026;Chercheur-e post-doctorant-e (H/F) en biologie moléculaire/Génomique;PARIS 13;vendredi 20 novembre 2020;CDD Scientifique;12;Temps complet;entre 2730 € et 3880 € bruts, selon l expérience;2730;3880;Doctorat;Indifférent
https://emploi.cnrs.fr/Offres/CDD/UMR7592-ISALAD-028/Default.aspx;UMR7592-ISALAD-028;Chercheur-e post-doctorant-e (H/F) en biologie moléculaire/Génomique;PARIS 13;mardi 1 décembre 2020;CDD Scientifique;12;Temps complet;entre 2730 et 3880 € bruts, selon expérience;2730;3880;Doctorat;Indifférent
https://emploi.cnrs.fr/Offres/CDD/UMR8506-STEDOU-005/Default.aspx;UMR8506-STEDOU-005;(H/F) Nouveau cadre de théorie de la communication au-delà de Shannon: principes fondamentaux et algorithmes (basés sur des modèles et basés sur les données);GIF SUR YVETTE;vendredi 4 décembre 2020;CDD Scientifique;12;Temps complet;entre 2728€ et 3880€ brut selon expérience;2728;3880;Doctorat;Indifférent
https://emploi.cnrs.fr/Offres/CDD/UPR288-BRILLO-018/Default.aspx;UPR288-BRILLO-018;Post-doctorant en caractérisation expérimentale ou numérique de la production de particules solides dans des flammes turbulentes (H/F);GIF SUR YVETTE;vendredi 4 décembre 2020;CDD Scientifique;12;Temps complet;Entre2 695,56 et 3 841,41 € bruts mensuels selon expérience;2695.56;3841.41;Bac+5;Indifférent
https://emploi.cnrs.fr/Offres/CDD/UMR8247-VINMAU-003/Default.aspx;UMR8247-VINMAU-003;Postdoctoral position Corrosion Initiation Mechanisms at the Nanometric/AtomicScale” (H/F);PARIS 05;mercredi 16 décembre 2020;CDD Scientifique;12;Temps complet;2696 € à 3841 € brut par mois, selon qualification et expérience;2696;3841;Doctorat;Indifférent
https://emploi.cnrs.fr/Offres/CDD/UMR8197-NATBOI-058/Default.aspx;UMR8197-NATBOI-058;Chercheur H/F en Etude électrophysiologique de la voie cervelet-thalamus;PARIS 05;mercredi 3 mars 2021;CDD Scientifique;6;Temps complet;Salaire brut mensuel compris entre 3100 et 3840 euros selon expérience;3100;3840;Doctorat;Indifférent
https://emploi.cnrs.fr/Offres/CDD/UMR8197-NATBOI-055/Default.aspx;UMR8197-NATBOI-055;Chercheur H/F dans le domaine de l intégration multi-omique à cellule unique;PARIS 05;lundi 21 décembre 2020;CDD Scientifique;12;Temps complet;Salaire brut mensuel compris entre 3100 et 3840 euros selon expérience;3100;3840;Doctorat;Indifférent
https://emploi.cnrs.fr/Offres/CDD/UMR5235-MAINGU-004/Default.aspx;UMR5235-MAINGU-004;Chercheur·e post-doctorant·e en Immunologie H/F;MONTPELLIER;vendredi 19 mars 2021;CDD Scientifique;15;Temps complet;Salaire brut mensuel compris entre 2695 et 3840 euros selon expérience;2695;3840;Doctorat;Indifférent
https://emploi.cnrs.fr/Offres/CDD/UMR7159-MYRKHO-010/Default.aspx;UMR7159-MYRKHO-010;Postdoc au LOCEAN/IPSL (Paris) en modélisation paléoclimatique  (H/F);PARIS 05;mardi 5 janvier 2021;CDD Scientifique;24;Temps complet;Salaire mensuel brut : entre 2 291€  et 3 815 € (en fonction de l expérience );2291;3815;Doctorat;Indifférent
https://emploi.cnrs.fr/Offres/CDD/USR3278-BENPUJ0-006/Default.aspx;USR3278-BENPUJ0-006;Post-doc H/F en épigénétique, écologie et évolution;PERPIGNAN;lundi 21 décembre 2020;CDD Scientifique;6;Temps complet;de 2679 à 3806 € bruts mensuels selon expérience;2679;3806;Doctorat;Indifférent
https://emploi.cnrs.fr/Offres/CDD/UMR7093-JEAIRI-002/Default.aspx;UMR7093-JEAIRI-002;Post-doc (H/F) : Modélisation de la distribution d espèces et de groupes de gènes à l échelle globale via apprentissage supervisé sur les données Tara Océans - Projet Blue Cloud;VILLEFRANCHE SUR MER;lundi 22 février 2021;CDD Scientifique;12;Temps complet;Entre 2675,28 € et 3805,92 € bruts mensuels pour une expérience inférieure à 7 ans.;2675.28;3805.92;Doctorat;Indifférent
https://emploi.cnrs.fr/Offres/CDD/UMR7361-CAMGHI-005/Default.aspx;UMR7361-CAMGHI-005;Post-doctorant.e (H/F) en matériaux carbonés durs pour les batteries Na-ion;MULHOUSE;mercredi 3 février 2021;CDD Scientifique;12;Temps complet;entre  2 675,28 euros et 3 805,92 €  brut mensuel selon expérience;2675.28;3805.92;Doctorat;1 à 4 années
https://emploi.cnrs.fr/Offres/CDD/UMR7010-SERNAZ-004/Default.aspx;UMR7010-SERNAZ-004;Postdoc H/F;NICE;lundi 14 décembre 2020;CDD Scientifique;2;Temps complet;la rémunération brute mensuelle est de 2675,28€ pouvant aller jusqu à 3805,92€ selon experience;2675.28;3805.92;Doctorat;1 à 4 années
https://emploi.cnrs.fr/Offres/CDD/UMR7178-REGSOM-074/Default.aspx;UMR7178-REGSOM-074;H/F Post-doctorant en mesure et instrumentation pour l étude des réactions (n,xn) d intérêt pour les réacteurs nucléaires;STRASBOURG;lundi 22 mars 2021;CDD Scientifique;24;Temps complet;Entre 2675,27 et 3805,92 euros bruts mensuels selon expérience;2675.27;3805.92;Doctorat;Indifférent
https://emploi.cnrs.fr/Offres/CDD/UMR6508-SANSOC-001/Default.aspx;UMR6508-SANSOC-001;Post-Doctorant en frittage flash (H/F);CAEN;vendredi 2 avril 2021;CDD Scientifique;7;Temps complet;entre 2675€ et 3805€ bruts mensuels selon expérience;2675;3805;Doctorat;1 à 4 années
