link;reference;title;jobLocation;datePosted;employmentType;duration.months;workHours;baseSalary;Salaire.brut.min;Salaire.brut.max;educationRequirements;experienceRequirements
https://emploi.cnrs.fr/Offres/CDD/MOY700-SANBUS-043/Default.aspx;MOY700-SANBUS-043;Conducteur de travaux immobiliers (H/F);VILLEURBANNE;mardi 19 janvier 2021;CDD Technique/Administratif;12;Temps complet;1950 à 2394€ brut mensuel selon expérience et expertise;1950;2394;Bac+2;Indifférent
https://emploi.cnrs.fr/Offres/CDD/UAR6402-HAYAID-016/Default.aspx;UAR6402-HAYAID-016;Assistant Ingénieur en informatique (H/F);VILLEURBANNE;mercredi 10 mars 2021;CDD Technique/Administratif;12;Temps complet;Entre 1950€ et 2386€ bruts mensuels en fonction de l expérience et de la qualification;1950;2386;Bac+2;Indifférent
https://emploi.cnrs.fr/Offres/CDD/UMR7275-BRUANT-002/Default.aspx;UMR7275-BRUANT-002;Assistant ingénieur H/F en purification de protéines et caractérisation d organelle;VALBONNE;mardi 23 février 2021;CDD Technique/Administratif;24;Temps complet;entre 1950 et 2386 euros bruts mensuels selon expérience;1950;2386;Bac+2;Indifférent
https://emploi.cnrs.fr/Offres/CDD/UMR7319-NATLEB2-004/Default.aspx;UMR7319-NATLEB2-004;Gestionnaire administratif et financier (H/F);AMIENS;mardi 22 décembre 2020;CDD Technique/Administratif;3;Temps complet;1950 à 2386 euros brut mensuel;1950;2386;Bac+2;1 à 4 années
https://emploi.cnrs.fr/Offres/CDD/UMR8522-JEAHAN0-001/Default.aspx;UMR8522-JEAHAN0-001;Assistant.e ingénieur.e (H/F) informatique - gestionnaire d infrastructure;VILLENEUVE D ASCQ;lundi 14 décembre 2020;CDD Technique/Administratif;12;Temps complet;1950-2386 € brut mensuel;1950;2386;Bac+2;Indifférent
https://emploi.cnrs.fr/Offres/CDD/USR3380-HELCOL-001/Default.aspx;USR3380-HELCOL-001;Assitant-e ingénieur-e en gestion administrative (H/F);VILLENEUVE D ASCQ;vendredi 4 décembre 2020;CDD Technique/Administratif;12;Temps complet;entre 1950 et 2386 € bruts mensuels selon expérience;1950;2386;Bac+2;Indifférent
https://emploi.cnrs.fr/Offres/CDD/MOY2000-LAUSCH1-025/Default.aspx;MOY2000-LAUSCH1-025;Conducteur de travaux immobiliers H/F;SOPHIA ANTIPOLIS;mardi 19 janvier 2021;CDD Technique/Administratif;6;Temps complet;entre 1950 et 2385 € bruts mensuels selon expérience;1950;2385;Bac+2;Indifférent
https://emploi.cnrs.fr/Offres/CDD/MOY2000-LAUSCH1-023/Default.aspx;MOY2000-LAUSCH1-023;Chargé(e) de justification des contrats européens (H/F);SOPHIA ANTIPOLIS;mercredi 6 janvier 2021;CDD Technique/Administratif;12;Temps complet;Entre 1950 et 2385 € bruts mensuels selon expérience professionnelle;1950;2385;Bac+2;Indifférent
https://emploi.cnrs.fr/Offres/CDD/MOY1000-EMMSTR-069/Default.aspx;MOY1000-EMMSTR-069;Chargé-e de la gestion des ressources humaines H/F;STRASBOURG;lundi 23 novembre 2020;CDD Technique/Administratif;11;Temps complet;Entre 2109,55 et 2375,03 euros brut mensuels, selon expérience;2109.55;2375.03;Bac+3;5 à 10 années
https://emploi.cnrs.fr/Offres/CDD/UMR9004-RAPGAU-005/Default.aspx;UMR9004-RAPGAU-005;Ingénieur en neuro-virologie (H/F);MONTPELLIER;vendredi 12 mars 2021;CDD Technique/Administratif;12;Temps complet;entre 2082.60 € et 2375.02 € Bruts Mensuels;2082.6;2375.02;Ingénieur;Indifférent
https://emploi.cnrs.fr/Offres/CDD/UMR5558-LAUJAC-002/Default.aspx;UMR5558-LAUJAC-002;Ingénieur.e statisticien.ne (H/F);VILLEURBANNE;mardi 16 février 2021;CDD Technique/Administratif;4;Temps complet;entre 2109 € et 2375 € bruts mensuels selon expérience;2109;2375;Bac+3;Indifférent
https://emploi.cnrs.fr/Offres/CDD/UMR5190-SOPRAU-002/Default.aspx;UMR5190-SOPRAU-002;Chargé.e de gestion administrative et d aide au pilotage opérationnel – secrétaire général.e (H/F);LYON 07;vendredi 5 février 2021;CDD Technique/Administratif;3;Temps complet;entre 2109 et 2375€ brut mensuel selon expérience;2109;2375;Bac+3;Indifférent
https://emploi.cnrs.fr/Offres/CDD/USR6402-HAYAID-014/Default.aspx;USR6402-HAYAID-014;ingénieur DevOps : intégration d applications (H/F);VILLEURBANNE;mardi 17 novembre 2020;CDD Technique/Administratif;12;Temps complet;Entre 2109€ et 2375€ bruts mensuels selon expérience;2109;2375;Bac+4;Indifférent
https://emploi.cnrs.fr/Offres/CDD/USR6402-HAYAID-013/Default.aspx;USR6402-HAYAID-013;Ingénieur en informatique (H/F);VILLEURBANNE;mardi 17 novembre 2020;CDD Technique/Administratif;6;Temps complet;Entre 2109€ et 2375€ bruts mensuels selon expérience;2109;2375;Bac+3;Indifférent
https://emploi.cnrs.fr/Offres/CDD/UPR3266-VERMAR-034/Default.aspx;UPR3266-VERMAR-034;H/F Ingénieur(e) Qualité  Projets;CAEN;mercredi 17 mars 2021;CDD Technique/Administratif;24;Temps complet;Entre 2 100 € et 2 375 € brut mensuel selon expérience;2100;2375;Bac+5;1 à 4 années
https://emploi.cnrs.fr/Offres/CDD/UMR7036-ANNCLA-001/Default.aspx;UMR7036-ANNCLA-001;Ingénieur en calcul scientifique (H/F);VANDOEUVRE LES NANCY;mercredi 16 décembre 2020;CDD Technique/Administratif;8;Temps complet;Entre 2019 € et 2375 € bruts mensuels selon expérience;2019;2375;Bac+5;Indifférent
https://emploi.cnrs.fr/Offres/CDD/UAR6402-CHRDUR-114/Default.aspx;UAR6402-CHRDUR-114;CDD Ingénieur en informatique, développeur d applications web (H/F);VILLEURBANNE;mercredi 3 mars 2021;CDD Technique/Administratif;12;Temps complet;entre 2109 € et 2372 € bruts mensuels selon expérience;2109;2372;Bac+5;Indifférent
https://emploi.cnrs.fr/Offres/CDD/UMS839-AURMAR-001/Default.aspx;UMS839-AURMAR-001;Administrateur systèmes et réseaux H/F;PARIS 05;vendredi 5 mars 2021;CDD Technique/Administratif;12;Temps complet;entre 2109 € et 2372 € bruts mensuels selon expérience et diplôme;2109;2372;Bac+3;Indifférent
https://emploi.cnrs.fr/Offres/CDD/USR6402-CHRDUR-111/Default.aspx;USR6402-CHRDUR-111;CDD Ingénieur en informatique, développeur d applications web (H/F);VILLEURBANNE;vendredi 18 décembre 2020;CDD Technique/Administratif;12;Temps complet;entre 2109 € et 2372 € bruts mensuels selon expérience;2109;2372;Bac+5;Indifférent
https://emploi.cnrs.fr/Offres/CDD/MOY2000-LAUSCH1-026/Default.aspx;MOY2000-LAUSCH1-026;Assistant en gestion des ressources humaines H/F;SOPHIA ANTIPOLIS;vendredi 5 février 2021;CDD Technique/Administratif;6;Temps complet;entre 1950 et 2360 euros bruts mensuels selon expérience;1950;2360;Bac+2;Indifférent
https://emploi.cnrs.fr/Offres/CDD/UAR5638-AGNAGA-005/Default.aspx;UAR5638-AGNAGA-005;Chargé-e d édition H/F;GRENOBLE;jeudi 25 mars 2021;CDD Technique/Administratif;12;Temps complet;De 2206.09 à 2351.51 bruts mensuels selon expérience;2206.09;2351.51;Bac+3;Indifférent
https://emploi.cnrs.fr/Offres/CDD/UAR5638-AGNAGA-004/Default.aspx;UAR5638-AGNAGA-004;Ingénieur-e en ingénierie logicielle H/F;GRENOBLE;jeudi 25 mars 2021;CDD Technique/Administratif;12;Temps complet;de 2206.09 à 2351.51 euros bruts mensuels selon expérience;2206.09;2351.51;Bac+3;Indifférent
https://emploi.cnrs.fr/Offres/CDD/UPR8001-LAUBAR-006/Default.aspx;UPR8001-LAUBAR-006;Ingénieur-e en conception électronique H/F;TOULOUSE;vendredi 11 décembre 2020;CDD Technique/Administratif;12;Temps complet;Entre 2088,66 € et 2351,51 € brut mensuel selon expérience.;2088.66;2351.51;Bac+5;Indifférent
https://emploi.cnrs.fr/Offres/CDD/UPR3021-ISAZOL-033/Default.aspx;UPR3021-ISAZOL-033;Ingénieur en génie des procédés-combution (H/F);ORLEANS;jeudi 19 novembre 2020;CDD Technique/Administratif;6;Temps complet;entre 2088.66 et 2351.51€ bruts mensuels selon expérience;2088.66;2351.51;Bac+5;Indifférent
https://emploi.cnrs.fr/Offres/CDD/UPR5301-ISACAL-066/Default.aspx;UPR5301-ISACAL-066;Chargé(e) d affaires Institut Carnot Polynat (H/F);GRENOBLE;vendredi 5 février 2021;CDD Technique/Administratif;12;Temps complet;entre 2 206 et 2 351 € bruts mensuels selon expérience;2206;2351;Bac+5;5 à 10 années
https://emploi.cnrs.fr/Offres/CDD/UMR5089-DAVBOU-001/Default.aspx;UMR5089-DAVBOU-001;Ingénieur-e H/F d études en calcul scientifique;TOULOUSE;mercredi 31 mars 2021;CDD Technique/Administratif;12;Temps complet;entre 2088€ et 2351€ bruts mensuels selon expérience;2088;2351;Bac+5;Indifférent
https://emploi.cnrs.fr/Offres/CDD/UMR5602-PABDOM-003/Default.aspx;UMR5602-PABDOM-003;H/F (D2A41 Ingénieur- d études) : SINJAJEVINA. Aires Pastorales Conservées par des Communautés locales dans les montagnes du Monténégro et Patrimonialisation socio-écologique;TOULOUSE;mercredi 31 mars 2021;CDD Technique/Administratif;28;Temps complet;entre 2088 et 2351€ bruts mensuels selon expérience;2088;2351;Bac+3;Indifférent
https://emploi.cnrs.fr/Offres/CDD/UPR8001-LAUMAL-006/Default.aspx;UPR8001-LAUMAL-006;Ingénieur(e) d étude en fabrication additive (H/F);TOULOUSE;vendredi 5 mars 2021;CDD Technique/Administratif;12;Temps complet;entre 2088 et 2351 € bruts mensuels selon expérience;2088;2351;Bac+3;Indifférent
https://emploi.cnrs.fr/Offres/CDD/MOY1700-CATTAN-053/Default.aspx;MOY1700-CATTAN-053;Administrateur-trice des systèmes d information pour la plate-forme GenOuest H/F;RENNES;mercredi 23 décembre 2020;CDD Technique/Administratif;12;Temps complet;2088 à 2351 euros brut mensuel selon expérience;2088;2351;Bac+3;Indifférent
https://emploi.cnrs.fr/Offres/CDD/UMR5502-YOHDAV-006/Default.aspx;UMR5502-YOHDAV-006;Ingénieur.e d étude en microbiologie (H/F);TOULOUSE;lundi 21 décembre 2020;CDD Technique/Administratif;3;Temps complet;entre 2088 et 2351€ bruts mensuel selon expérience;2088;2351;Bac+5;Indifférent
https://emploi.cnrs.fr/Offres/CDD/MOY1100-MARDER-025/Default.aspx;MOY1100-MARDER-025;Chargé-e d affaires partenariat et valorisation H/F;GRENOBLE;jeudi 17 décembre 2020;CDD Technique/Administratif;6;Temps complet;entre 2088 à 2351 euros bruts mensuels selon expérience;2088;2351;Bac+5;1 à 4 années
https://emploi.cnrs.fr/Offres/CDD/UMR5001-VALLAN0-047/Default.aspx;UMR5001-VALLAN0-047;Manager projets européens H/F;ST MARTIN D HERES;lundi 7 décembre 2020;CDD Technique/Administratif;12;Temps complet;Entre 2 088 € et 2 351 € bruts mensuels selon expérience;2088;2351;Bac+4;Indifférent
https://emploi.cnrs.fr/Offres/CDD/UPR3228-CATKNO-010/Default.aspx;UPR3228-CATKNO-010;Ingénieur(e) d Etude chargé(e) des relations industrielles H/F;TOULOUSE;jeudi 19 novembre 2020;CDD Technique/Administratif;12;Temps complet;entre 2088 et  2351 brut mensuel selon expérience;2088;2351;Bac+5;1 à 4 années
https://emploi.cnrs.fr/Offres/CDD/UMR5277-EMIDUP-090/Default.aspx;UMR5277-EMIDUP-090;Ingénieur-e Développement Python/Web/Javascript (H/F);TOULOUSE;jeudi 18 février 2021;CDD Technique/Administratif;12;Temps complet;entre 2088 et 2350€ bruts par mois selon expériences;2088;2350;Bac+3;1 à 4 années
https://emploi.cnrs.fr/Offres/CDD/UMR5277-EMIDUP-092/Default.aspx;UMR5277-EMIDUP-092;(H/F) Développeur.e informatique en bases de données, outils et applications web associés;TOULOUSE;lundi 1 mars 2021;CDD Technique/Administratif;12;Temps complet;entre 2088 et 2350€ bruts par mois selon expériences;2088;2350;Bac+3;Indifférent
https://emploi.cnrs.fr/Offres/CDD/UMR8617-ANNPHI-001/Default.aspx;UMR8617-ANNPHI-001;Dessinateur projeteur H/F;ORSAY;lundi 18 janvier 2021;CDD Technique/Administratif;12;Temps complet;Entre 1989€ brut mensuel  et 2348€ brut mensuel selon expérience;1989;2348;Bac+2;Indifférent
https://emploi.cnrs.fr/Offres/CDD/MOY400-NATSEN-063/Default.aspx;MOY400-NATSEN-063;Assistant des Ressources Humaines H/F;GIF SUR YVETTE;mardi 19 janvier 2021;CDD Technique/Administratif;12;Temps complet;entre 1 988€ et 2 348 € brut par mois;1988;2348;Bac+2;Indifférent
https://emploi.cnrs.fr/Offres/CDD/MOY400-NATSEN-064/Default.aspx;MOY400-NATSEN-064;Assistant des Ressources Humaines H/F;GIF SUR YVETTE;mardi 19 janvier 2021;CDD Technique/Administratif;12;Temps complet;entre 1 988€ et 2 348 € brut par mois;1988;2348;Bac+2;Indifférent
https://emploi.cnrs.fr/Offres/CDD/MOY400-NATSEN-062/Default.aspx;MOY400-NATSEN-062;Assistant-e des ressources humaines H/F;GIF SUR YVETTE;mardi 15 décembre 2020;CDD Technique/Administratif;12;Temps complet;entre 1988€ et 2348€ bruts mensuel selon expérience;1988;2348;Bac+2;Indifférent
https://emploi.cnrs.fr/Offres/CDD/MOY400-STERIG-123/Default.aspx;MOY400-STERIG-123;Assistant-e en gestion financière et comptable (H/F);GIF SUR YVETTE;vendredi 20 novembre 2020;CDD Technique/Administratif;12;Temps complet;Entre 1.988 et 2.348 € bruts mensuels selon expérience;1988;2348;Bac+2;Indifférent
https://emploi.cnrs.fr/Offres/CDD/UMR8578-TIBMIN0-015/Default.aspx;UMR8578-TIBMIN0-015;AI - Assistent Ingénieur en études mécaniques et conception 3D H/F;ORSAY;jeudi 26 novembre 2020;CDD Technique/Administratif;12;Temps complet;1988 et 2348 Euro brut/mois;1988;2348;Bac+3;Indifférent
https://emploi.cnrs.fr/Offres/CDD/MOY400-NATSEN-060/Default.aspx;MOY400-NATSEN-060;Assistant des Ressources Humaines H/F;GIF SUR YVETTE;jeudi 26 novembre 2020;CDD Technique/Administratif;12;Temps complet;entre 1988€ et 2348€ bruts mensuel selon expérience;1988;2348;Bac+2;Indifférent
https://emploi.cnrs.fr/Offres/CDD/MOY400-NATSEN-059/Default.aspx;MOY400-NATSEN-059;Assistant des Ressources Humaines H/F;GIF SUR YVETTE;jeudi 26 novembre 2020;CDD Technique/Administratif;12;Temps complet;entre 1988€ et 2348€ bruts mensuel selon expérience;1988;2348;Bac+2;Indifférent
https://emploi.cnrs.fr/Offres/CDD/MOY400-NATSEN-061/Default.aspx;MOY400-NATSEN-061;Assistant des Ressources Humaines H/F;GIF SUR YVETTE;jeudi 26 novembre 2020;CDD Technique/Administratif;6;Temps complet;entre 1988€ et 2348€ bruts mensuel selon expérience;1988;2348;Bac+2;Indifférent
https://emploi.cnrs.fr/Offres/CDD/UMR8214-BERUST-009/Default.aspx;UMR8214-BERUST-009;Assistant(e) en gestion administrative des personnels de l unité H/F;ORSAY;jeudi 3 décembre 2020;CDD Technique/Administratif;12;Temps complet;entre 1988€ et 2348€ bruts mensuel selon expérience;1988;2348;Bac+2;Indifférent
https://emploi.cnrs.fr/Offres/CDD/UMR9012-SOPHEB-027/Default.aspx;UMR9012-SOPHEB-027;ASSISTANT-E INGENIEUR-E EN ETUDES MECANIQUES (F/H) (H/F);ORSAY;jeudi 7 janvier 2021;CDD Technique/Administratif;18;Temps complet;Entre 1930 € et 2340 € bruts mensuels selon expérience;1930;2340;Bac+2;Indifférent
https://emploi.cnrs.fr/Offres/CDD/UMR7186-BAPBUO-001/Default.aspx;UMR7186-BAPBUO-001;Enquêteur (H/F) sur la gestion matérielle des morts migrants à la frontière basse franco-italienne;NANTERRE;mercredi 10 mars 2021;CDD Technique/Administratif;6;Temps complet;entre 2150€ et 2300€ bruts mensuels selon expérience;2150;2300;Bac+5;Indifférent
https://emploi.cnrs.fr/Offres/CDD/MOY1300-CHRMOR-011/Default.aspx;MOY1300-CHRMOR-011;Assistant-e en partenariat_H/F;MONTPELLIER;jeudi 18 mars 2021;CDD Technique/Administratif;7;Temps complet;entre 1950 € et 2 300 € bruts mensuels selon expérience;1950;2300;Bac+2;Indifférent
https://emploi.cnrs.fr/Offres/CDD/UAR2966-CLABOD-002/Default.aspx;UAR2966-CLABOD-002;Coordinateur(trice) Logistique (H/F);ANNECY;jeudi 11 février 2021;CDD Technique/Administratif;18;Temps complet;entre 1 930 € et 2 280 € bruts mensuels selon expérience;1930;2280;Bac+2;1 à 4 années
https://emploi.cnrs.fr/Offres/CDD/UAR2966-CLABOD-001/Default.aspx;UAR2966-CLABOD-001;Gestionnaire administratif(ve) et financièr(e) (H/F);ANNECY;jeudi 11 février 2021;CDD Technique/Administratif;18;Temps complet;entre 1 930 € et 2 280 € bruts mensuels selon expérience;1930;2280;Bac+2;Indifférent
https://emploi.cnrs.fr/Offres/CDD/UMR7099-FRAZIT-001/Default.aspx;UMR7099-FRAZIT-001;Ingénieur(e) en biochimie des protéines membranaires (H/F): expression, purification, caractérisation structurale du complexe cytochrome b6f de l algue verte Chlamydomonas reinhardtii;PARIS 05;jeudi 11 février 2021;CDD Technique/Administratif;24;Temps complet;entre 2 151 € et 2 275€ brut mensuel selon expérience professionnelle;2151;2275;Bac+5;Indifférent
https://emploi.cnrs.fr/Offres/CDD/UMR8239-RHAAMR-002/Default.aspx;UMR8239-RHAAMR-002;Chargée ou chargé de médiation scientifique (H/F);PARIS 07;jeudi 1 avril 2021;CDD Technique/Administratif;4;Temps complet;entre 2151,32 et 2272, 27 euros bruts mensuels selon expérience;2151.32;2272.27;Bac+3;Indifférent
https://emploi.cnrs.fr/Offres/CDD/UMR7283-DELLER-040/Default.aspx;UMR7283-DELLER-040;Ingénieur d études en microbiologie H/F;MARSEILLE 09;lundi 22 mars 2021;CDD Technique/Administratif;12;Temps complet;entre 2151,31 et 2272,27 bruts mensuels selon expérience;2151.32;2272.27;Bac+3;1 à 4 années
https://emploi.cnrs.fr/Offres/CDD/UMR7280-SANSAR-001/Default.aspx;UMR7280-SANSAR-001;Ingénieur(e) d étude (H/F) - Biologie;MARSEILLE 09;mardi 23 mars 2021;CDD Technique/Administratif;19;Temps complet;Entre 2151,32 et 2272.27€ bruts mensuels, selon expérience;2151.32;2272.27;Bac+5;Indifférent
https://emploi.cnrs.fr/Offres/CDD/UMR7291-PATDEL-003/Default.aspx;UMR7291-PATDEL-003;Ingenieur d étude en biologie-neuroscience  (H/F);MARSEILLE 02;jeudi 25 mars 2021;CDD Technique/Administratif;12;Temps complet;entre 2151.32 et 2272.27€ bruts mensuels selon expérience;2151.32;2272.27;Bac+5;1 à 4 années
https://emploi.cnrs.fr/Offres/CDD/MOY1200-GERDEM-017/Default.aspx;MOY1200-GERDEM-017;Chargé-e de projets de culture scientifique ( H/F);MARSEILLE 09;mardi 30 mars 2021;CDD Technique/Administratif;6;Temps complet;entre 2151.32 et 2272.27 euros bruts mensuels;2151.32;2272.27;Bac+3;Indifférent
https://emploi.cnrs.fr/Offres/CDD/UMR7280-LENALE-002/Default.aspx;UMR7280-LENALE-002;Ingénieur-e en techniques biologiques (H/F);MARSEILLE 09;mardi 30 mars 2021;CDD Technique/Administratif;24;Temps complet;2151.32 et 2272.27€ bruts mensuels.;2151.32;2272.27;Bac+5;1 à 4 années
https://emploi.cnrs.fr/Offres/CDD/UMR7258-PIEGAI-005/Default.aspx;UMR7258-PIEGAI-005;CDD Ingénieur d étude (H/F) en biologie cellulaire et moléculaire;MARSEILLE 08;lundi 1 mars 2021;CDD Technique/Administratif;36;Temps complet;entre 2151.32 et 2272.27 euros bruts mensuels;2151.32;2272.27;Bac+3;1 à 4 années
https://emploi.cnrs.fr/Offres/CDD/UMR7263-KHEBOU-001/Default.aspx;UMR7263-KHEBOU-001;(H/F) : Ingénieur(e) d étude en hydrogéologie (milieu aquatique et berges);MARSEILLE 13;lundi 1 mars 2021;CDD Technique/Administratif;12;Temps complet;entre 2151,32€ et 2 272,27€ brut mensuel;2151.32;2272.27;Bac+5;Indifférent
https://emploi.cnrs.fr/Offres/CDD/UMR7258-BERLLO-004/Default.aspx;UMR7258-BERLLO-004;Ingénieur H/F en microbiologie et génétique moléculaire des levures;MARSEILLE 08;mardi 16 février 2021;CDD Technique/Administratif;12;Temps complet;entre 2151.32 et 2272.27 euros bruts mensuels;2151.32;2272.27;Bac+5;1 à 4 années
https://emploi.cnrs.fr/Offres/CDD/MOY1200-GERDEM-016/Default.aspx;MOY1200-GERDEM-016;Chargé-e de la maintenance et de l exploitation du patrimoine immobilier ( H/F);MARSEILLE 09;jeudi 11 février 2021;CDD Technique/Administratif;12;Temps complet;entre 2151.32 et 2272.27 euros bruts mensuels;2151.32;2272.27;Bac+5;Indifférent
https://emploi.cnrs.fr/Offres/CDD/UMR7280-LENALE-002/Default.aspx;UMR7280-LENALE-002;Ingénieur-e en techniques biologiques (H/F);MARSEILLE 09;mardi 9 février 2021;CDD Technique/Administratif;24;Temps complet;2151.32 et 2272.27€ bruts mensuels.;2151.32;2272.27;Bac+5;1 à 4 années
https://emploi.cnrs.fr/Offres/CDD/MOY1200-GERDEM-015/Default.aspx;MOY1200-GERDEM-015;Acheteur/se chargé-e des achats (H/F);MARSEILLE 09;mardi 9 février 2021;CDD Technique/Administratif;9;Temps complet;entre 2151.32 et 2272.27 euros bruts mensuels;2151.32;2272.27;Bac+3;Indifférent
https://emploi.cnrs.fr/Offres/CDD/MOY1200-GERDEM-014/Default.aspx;MOY1200-GERDEM-014;Chargé-e d affaires Partenariat et valorisation ( H/F);MARSEILLE 09;lundi 8 février 2021;CDD Technique/Administratif;7;Temps complet;entre 2151.32 et 2272.27 euros bruts mensuels;2151.32;2272.27;Bac+3;1 à 4 années
https://emploi.cnrs.fr/Offres/CDD/UMR7263-MARBER-002/Default.aspx;UMR7263-MARBER-002;Manager de projet (H/F);MARSEILLE 13;mercredi 20 janvier 2021;CDD Technique/Administratif;12;Temps complet;entre 2151,32 et 2272,27 euros brut mensuels;2151.32;2272.27;Bac+5;Indifférent
https://emploi.cnrs.fr/Offres/CDD/UMR7341-OLIUTE-004/Default.aspx;UMR7341-OLIUTE-004;Ingénieur (H/F) en conception et réalisation mécanique;MARSEILLE 09;lundi 30 novembre 2020;CDD Technique/Administratif;12;Temps complet;entre 2151,32 et 2272,27 euros bruts mensuels selon expérience;2151.32;2272.27;Bac+3;Indifférent
https://emploi.cnrs.fr/Offres/CDD/UMR7283-DELLER-036/Default.aspx;UMR7283-DELLER-036;Ingénieur(e) en Microbiologie et Biologie Moléculaire H/F;MARSEILLE 09;lundi 30 novembre 2020;CDD Technique/Administratif;24;Temps complet;entre 2151,31€ et 2272,27€ bruts;2151.32;2272.27;Bac+3;1 à 4 années
https://emploi.cnrs.fr/Offres/CDD/USR2004-BRUCEN-001/Default.aspx;USR2004-BRUCEN-001;OpenEdition recrute un.e administrateur.trice systèmes et réseaux H/F;MARSEILLE 13;lundi 30 novembre 2020;CDD Technique/Administratif;12;Temps complet;Entre 2151.32 et 2272.27 euros bruts mensuels selon grille CNRS basée sur diplôme et expérience;2151.32;2272.27;Bac+3;Indifférent
https://emploi.cnrs.fr/Offres/CDD/UMR7283-DELLER-038/Default.aspx;UMR7283-DELLER-038;Ingénieur(e) en Microbiologie H/F;MARSEILLE 09;mardi 8 décembre 2020;CDD Technique/Administratif;12;Temps complet;entre 2151,31€ et 2272,27€ bruts mensuels selon expérience;2151.31;2272.27;Bac+3;Indifférent
https://emploi.cnrs.fr/Offres/CDD/UMR7283-DELLER-037/Default.aspx;UMR7283-DELLER-037;Ingénieur(e) en Microbiologie H/F;MARSEILLE 09;mardi 8 décembre 2020;CDD Technique/Administratif;12;Temps complet;entre 2151,31€ et 2272,27€ bruts mensuels selon expérience;2151.31;2272.27;Bac+3;Indifférent
https://emploi.cnrs.fr/Offres/CDD/UMR7583-GENTUA-024/Default.aspx;UMR7583-GENTUA-024;Ingénieur(e) projet européen (H/F);CRETEIL;lundi 16 novembre 2020;CDD Technique/Administratif;12;Temps complet;entre 2 151,31 à 2 272,27 euros bruts mensuel selon expérience;2151.31;2272.27;Bac+5;1 à 4 années
https://emploi.cnrs.fr/Offres/CDD/UMR7265-BERGEN-001/Default.aspx;UMR7265-BERGEN-001;Ingénieur d étude - Biophysique - H/F;ST PAUL LES DURANCE;mardi 8 décembre 2020;CDD Technique/Administratif;12;Temps complet;entre 2 151 et 2 2272 € bruts mensuels selon expérience;2151;2272.27;Bac+3;1 à 4 années
https://emploi.cnrs.fr/Offres/CDD/UMR8209-CARKLE-006/Default.aspx;UMR8209-CARKLE-006;Chargé(e) de mission polyvalent(e), spécilaité en gestion financière et comptable H/F;PARIS 05;jeudi 11 mars 2021;CDD Technique/Administratif;8;Temps complet;entre 2151 € et 2272 € bruts mensuels selon expérience;2151;2272;Bac+3;Indifférent
https://emploi.cnrs.fr/Offres/CDD/UMR7265-NAJCOM-013/Default.aspx;UMR7265-NAJCOM-013;Ingénieur d étude - Biophysique - H/F;ST PAUL LES DURANCE;mardi 23 février 2021;CDD Technique/Administratif;12;Temps complet;entre 2 151 et  2 272 € bruts mensuels selon expérience;2151;2272;Bac+3;1 à 4 années
https://emploi.cnrs.fr/Offres/CDD/UAR3611-VERLAU-002/Default.aspx;UAR3611-VERLAU-002;H/F ingénieur logiciel;PARIS 13;lundi 1 mars 2021;CDD Technique/Administratif;5;Temps complet;entre 2151 € et 2272 € bruts/mois selon expérience;2151;2272;Bac+4;1 à 4 années
https://emploi.cnrs.fr/Offres/CDD/UMR8258-CORMAR-001/Default.aspx;UMR8258-CORMAR-001;Ingénieur(e) d études en biologie (H/F);PARIS 06;mardi 12 janvier 2021;CDD Technique/Administratif;18;Temps complet;Entre 2151 et 2272 euros bruts mensuels selon expérience;2151;2272;Bac+5;1 à 4 années
https://emploi.cnrs.fr/Offres/CDD/UMS828-MARDAR-002/Default.aspx;UMS828-MARDAR-002;Ingénieur-e d études H/F en traitement et analyse de données et enquêtes;PARIS 07;lundi 4 janvier 2021;CDD Technique/Administratif;4;Temps complet;entre 2151€ et 2272€ bruts selon expérience;2151;2272;Bac+5;1 à 4 années
https://emploi.cnrs.fr/Offres/CDD/UMR7186-HELGAU-001/Default.aspx;UMR7186-HELGAU-001;Chargé.e de la FAIRisation de données scientifiques H/F;NANTERRE;jeudi 17 décembre 2020;CDD Technique/Administratif;4;Temps complet;entre 2151 et 2272 € bruts mensuels selon expérience;2151;2272;Bac+5;Indifférent
https://emploi.cnrs.fr/Offres/CDD/USR2004-ALELAC-005/Default.aspx;USR2004-ALELAC-005;H/F Chargé-e de traitement de données;MARSEILLE 13;jeudi 10 décembre 2020;CDD Technique/Administratif;12;Temps complet;entre 2151€ à 2272€ bruts mensuels selon expérience;2151;2272;Bac+3;Indifférent
https://emploi.cnrs.fr/Offres/CDD/USR2004-ALELAC-004/Default.aspx;USR2004-ALELAC-004;H/F Chargé-e de traitement de données;MARSEILLE 13;jeudi 10 décembre 2020;CDD Technique/Administratif;12;Temps complet;entre 2151€ à 2272€ bruts mensuels selon expérience;2151;2272;Bac+5;Indifférent
https://emploi.cnrs.fr/Offres/CDD/UMR7587-CHRJAC-002/Default.aspx;UMR7587-CHRJAC-002;Ingénieur d études instrumentation ultrasonore H/F;PARIS 05;mardi 8 décembre 2020;CDD Technique/Administratif;11;Temps complet;entre 2151€  et 2 272 € bruts mensuels selon expérience.;2151;2272;Bac+5;Indifférent
https://emploi.cnrs.fr/Offres/CDD/UPR3407-DOMVRE0-001/Default.aspx;UPR3407-DOMVRE0-001;Ingénieur d étude AFM/MEB (H/F);VILLETANEUSE;vendredi 4 décembre 2020;CDD Technique/Administratif;12;Temps complet;de 2151 € à 2272 € brut mensuel;2151;2272;Bac+3;1 à 4 années
https://emploi.cnrs.fr/Offres/CDD/UMR7372-SABGAB-005/Default.aspx;UMR7372-SABGAB-005;"Ingenieur-e d Etudes ""H/F"" - Cartographie Ressources Florales";VILLIERS EN BOIS;mercredi 10 février 2021;CDD Technique/Administratif;6;Temps complet;Entre 1661.98et 2272 euros bruts mensuels selon expérience;1667.98;2272;Bac+2;Indifférent
https://emploi.cnrs.fr/Offres/CDD/UMR7372-SABGAB-004/Default.aspx;UMR7372-SABGAB-004;Chargé.e de mission H/F « Releves botaniques en parcelles agricoles »;VILLIERS EN BOIS;vendredi 29 janvier 2021;CDD Technique/Administratif;6;Temps complet;Entre 1661.98et 2272 euros bruts mensuels selon expérience;1661.98;2272;Bac+2;Indifférent
